{
  "goal": "每天定时把昨天落库的新增合同扫描件 PDF 经 OCR 解析出关键字段，写入数据库。",
  "readiness": "partial",
  "understanding": [
    {
      "ref": "u1",
      "quote": "每天定时",
      "reading": "按固定时间触发，不是实时流式处理。"
    },
    {
      "ref": "u2",
      "quote": "把新增的合同 PDF",
      "reading": "处理对象是合同 PDF，只处理新增的那部分。"
    },
    {
      "ref": "u3",
      "quote": "解析出关键字段",
      "reading": "从 PDF 内容里抽取结构化的关键字段，具体抽哪些字段尚未说明。"
    },
    {
      "ref": "u4",
      "quote": "写进数据库",
      "reading": "最终落库，写到哪个库哪张表尚未说明。"
    },
    {
      "ref": "u5",
      "quote": "PDF 都是扫描件",
      "reading": "所有合同 PDF 都是扫描件，没有文字层，必须经 OCR 才能拿到文本。"
    },
    {
      "ref": "u6",
      "quote": "「新增」按文件落库时间算，每天处理昨天落库的",
      "reading": "新增口径为文件落库时间，每次定时处理落库时间为昨天的合同 PDF。"
    }
  ],
  "steps": [
    {
      "ref": "s1",
      "title": "定时筛出昨天落库的合同 PDF",
      "intent": "每次定时触发时，按文件落库时间挑出昨天落库的合同 PDF，作为本次处理对象。",
      "input": "触发：定时信号；数据：存放处的合同扫描件 PDF（带落库时间）。",
      "output": "昨天落库的合同 PDF 文件清单。",
      "dependsOn": []
    },
    {
      "ref": "s2",
      "title": "OCR 识别扫描件文本",
      "intent": "把扫描件 PDF 里的图像内容识别成纯文本，供后续字段抽取。",
      "input": "昨天落库的合同扫描件 PDF 文件。",
      "output": "每个 PDF 对应的纯文本内容。",
      "dependsOn": ["s1"]
    },
    {
      "ref": "s3",
      "title": "抽取关键字段",
      "intent": "从合同文本中识别并抽取约定的关键字段，形成结构化数据。",
      "input": "每个合同的纯文本内容。",
      "output": "每个合同对应的结构化关键字段。",
      "dependsOn": ["s2"]
    },
    {
      "ref": "s4",
      "title": "写入数据库",
      "intent": "把抽取出的结构化字段落成数据库里的合同记录。",
      "input": "结构化关键字段。",
      "output": "数据库中的合同记录。",
      "dependsOn": ["s3"]
    }
  ],
  "openQuestions": [
    {
      "ref": "q3",
      "question": "关键字段具体抽哪几个？",
      "reason": "第三环的抽取目标只有你那边有定义，缺了它这条链跑起来也不知道抽什么。",
      "affects": ["s3"]
    },
    {
      "ref": "q4",
      "question": "写进哪个数据库、哪张表？",
      "reason": "决定第四环的落库目标。",
      "affects": ["s4"]
    }
  ]
}
