{
  "goal": "每天定时把新增的合同 PDF 解析出关键字段，写进数据库。",
  "readiness": "partial",
  "understanding": [
    {
      "ref": "r1",
      "quote": "每天定时",
      "reading": "按天固定时间自动触发，不需要每次人工去跑。"
    },
    {
      "ref": "r2",
      "quote": "把新增的合同 PDF 解析出关键字段",
      "reading": "只处理新增的那部分合同，从 PDF 里抽出关键字段。"
    },
    {
      "ref": "r3",
      "quote": "写进数据库",
      "reading": "抽出来的字段最终落到数据库里，供后续使用。"
    },
    {
      "ref": "r4",
      "quote": "PDF 都是扫描件",
      "reading": "合同 PDF 是扫描件，解析要走 OCR。"
    },
    {
      "ref": "r5",
      "quote": "「新增」按文件落库时间算,每天处理昨天落库的",
      "reading": "每天处理的是昨天落库的文件，以文件落库时间为口径。"
    }
  ],
  "steps": [
    {
      "ref": "s1",
      "title": "识别昨天落库的合同 PDF",
      "intent": "每天固定时间，按文件落库时间把「昨天落库」的合同 PDF 挑出来，形成待处理清单。",
      "input": "定时信号 + 合同 PDF 的来源位置（含落库时间）",
      "output": "昨天落库、待处理的合同 PDF 清单",
      "dependsOn": []
    },
    {
      "ref": "s2",
      "title": "扫描件 OCR 成可读取的文本",
      "intent": "对每份扫描件 PDF 做 OCR，把它变成可以从中抽取字段的纯文本。",
      "input": "昨天落库、待处理的扫描件 PDF 清单",
      "output": "每份合同对应的纯文本内容",
      "dependsOn": [
        "s1"
      ]
    },
    {
      "ref": "s3",
      "title": "从文本抽取关键字段",
      "intent": "按约定的字段清单，从 OCR 出来的文本里抽出结构化字段，每份合同形成一条结构化记录。",
      "input": "每份合同对应的纯文本内容",
      "output": "每份合同一条的结构化字段记录",
      "dependsOn": [
        "s2"
      ]
    },
    {
      "ref": "s4",
      "title": "写入数据库",
      "intent": "把结构化字段落进约定的数据库表，供后续查询使用。",
      "input": "每份合同一条的结构化字段记录",
      "output": "数据库中的合同记录",
      "dependsOn": [
        "s3"
      ]
    }
  ],
  "openQuestions": [
    {
      "ref": "q3",
      "question": "关键字段具体是哪几个？",
      "reason": "决定第三环抽什么，直接影响最终入库的内容。",
      "affects": [
        "s3"
      ]
    },
    {
      "ref": "q4",
      "question": "写进哪个数据库、哪张表？",
      "reason": "决定第四环的落库目标。",
      "affects": [
        "s4"
      ]
    },
    {
      "ref": "q5",
      "question": "合同 PDF 从哪来（哪个文件夹、哪个系统或对象存储），落库时间从哪读？",
      "reason": "第一环需要一个来源位置和落库时间才能挑出昨天落库的文件。",
      "affects": [
        "s1"
      ]
    }
  ]
}
