{
  "readiness": "partial",
  "goal": "每天定时把新增的合同 PDF 解析出关键字段，写进数据库",
  "understanding": [
    {
      "ref": "u1",
      "quote": "每天定时",
      "reading": "由每日定时任务触发，不是手动批量处理"
    },
    {
      "ref": "u2",
      "quote": "新增的合同 PDF",
      "reading": "处理对象是每天新增的合同 PDF，'新增'的判定口径还没定"
    },
    {
      "ref": "u3",
      "quote": "解析出关键字段",
      "reading": "从 PDF 内容里提取关键字段，字段清单还没定"
    },
    {
      "ref": "u4",
      "quote": "写进数据库",
      "reading": "解析结果落到数据库，目标表还没定"
    }
  ],
  "steps": [
    {
      "ref": "s1",
      "title": "圈定当日新增合同 PDF",
      "intent": "每天圈出当天新增的合同 PDF，作为后续处理范围",
      "input": "无上游数据；由每日定时信号触发，扫描合同 PDF 的存放位置",
      "output": "当天新增的合同 PDF 文件清单",
      "dependsOn": []
    },
    {
      "ref": "s2",
      "title": "抽取合同文本",
      "intent": "把每份合同 PDF 的内容变成可解析的纯文本",
      "input": "新增合同 PDF 文件（带文字层）",
      "output": "每份合同对应的纯文本",
      "dependsOn": [
        "s1"
      ]
    },
    {
      "ref": "s3",
      "title": "解析关键字段",
      "intent": "从合同文本里提取关键字段，变成结构化记录",
      "input": "合同纯文本",
      "output": "结构化字段记录（每份合同一条或多条）",
      "dependsOn": [
        "s2"
      ]
    },
    {
      "ref": "s4",
      "title": "写入数据库",
      "intent": "把结构化字段记录写入数据库",
      "input": "结构化字段记录",
      "output": "数据库表中落库的合同字段",
      "dependsOn": [
        "s3"
      ]
    }
  ],
  "openQuestions": [
    {
      "ref": "q1",
      "question": "合同 PDF 是带文字层，还是扫描件？",
      "reason": "扫描件得先 OCR 才能出文本，链路上会多一步",
      "affects": [
        "s2"
      ],
      "options": [
        "带文字层",
        "扫描件",
        "两者都有"
      ]
    },
    {
      "ref": "q2",
      "question": "'新增'按什么口径判定？",
      "reason": "口径错了，每天圈进来的文件就不对，问题几个月后才暴露",
      "affects": [
        "s1"
      ],
      "options": [
        "按文件落盘/创建时间",
        "按文件名里的日期",
        "按来源系统推送的清单",
        "按是否已入库去重"
      ]
    },
    {
      "ref": "q3",
      "question": "要抽取哪些关键字段？",
      "reason": "决定解析环节要输出什么",
      "affects": [
        "s3"
      ]
    },
    {
      "ref": "q4",
      "question": "解析结果写进哪张表？",
      "reason": "决定落库目标",
      "affects": [
        "s4"
      ]
    }
  ]
}
