{
  "readiness": "partial",
  "goal": "每天定时把新增的合同 PDF 解析出关键字段，写进数据库。",
  "understanding": [
    {
      "ref": "r1",
      "quote": "每天定时",
      "reading": "按天固定时间自动触发，不需要每次人工去跑。"
    },
    {
      "ref": "r2",
      "quote": "把新增的合同 PDF 解析出关键字段",
      "reading": "只处理新增的那部分合同，从 PDF 里抽出关键字段。"
    },
    {
      "ref": "r3",
      "quote": "写进数据库",
      "reading": "抽出来的字段最终落到数据库里，供后续使用。"
    }
  ],
  "steps": [
    {
      "ref": "s1",
      "title": "识别本次新增的合同 PDF",
      "intent": "每天固定时间，按「新增」的口径把这一次要处理的合同 PDF 挑出来，形成待处理清单，不重复处理已经入库的。",
      "input": "定时信号 + 合同 PDF 的来源位置（全部 PDF）",
      "output": "本次新增、待处理的合同 PDF 清单",
      "dependsOn": []
    },
    {
      "ref": "s2",
      "title": "把 PDF 解析成可读取的文本",
      "intent": "把每份 PDF 变成可以从中抽取字段的纯文本内容。",
      "input": "本次新增、待处理的合同 PDF 清单",
      "output": "每份合同对应的纯文本内容",
      "dependsOn": [
        "s1"
      ]
    },
    {
      "ref": "s3",
      "title": "从文本抽取关键字段",
      "intent": "按约定的字段清单，从合同正文里抽出结构化字段，每份合同形成一条结构化记录。",
      "input": "每份合同对应的纯文本内容",
      "output": "每份合同一条的结构化字段记录",
      "dependsOn": [
        "s2"
      ]
    },
    {
      "ref": "s4",
      "title": "写入数据库",
      "intent": "把结构化字段落进约定的数据库表，供后续查询使用。",
      "input": "每份合同一条的结构化字段记录",
      "output": "数据库中的合同记录",
      "dependsOn": [
        "s3"
      ]
    }
  ],
  "openQuestions": [
    {
      "ref": "q1",
      "question": "合同 PDF 是扫描件还是带文字层？",
      "reason": "决定「PDF→文本」这一环走直接提取还是 OCR；两种都能走通，但执行方式差别很大。",
      "affects": [
        "s2"
      ],
      "options": [
        "扫描件",
        "带文字层",
        "两种都有"
      ]
    },
    {
      "ref": "q2",
      "question": "「新增」按什么口径算？",
      "reason": "决定第一环怎么把「要处理的」从全部 PDF 里挑出来，挑错会漏处理或重复处理。",
      "affects": [
        "s1"
      ],
      "options": [
        "新放进指定位置的文件",
        "数据库里还没有记录的合同",
        "上次运行之后新增或修改过的文件"
      ]
    },
    {
      "ref": "q3",
      "question": "关键字段具体是哪几个？",
      "reason": "决定第三环抽什么，直接影响最终入库的内容。",
      "affects": [
        "s3"
      ]
    },
    {
      "ref": "q4",
      "question": "写进哪个数据库、哪张表？",
      "reason": "决定第四环的落库目标。",
      "affects": [
        "s4"
      ]
    },
    {
      "ref": "q5",
      "question": "合同 PDF 从哪来（哪个文件夹、哪个系统或对象存储）？",
      "reason": "第一环需要一个来源位置才能发现新文件。",
      "affects": [
        "s1"
      ]
    }
  ]
}
