{
  "readiness": "partial",
  "goal": "把公司产品手册建成知识库，支持按语义（按意思）检索并返回相关段落。",
  "understanding": [
    {
      "ref": "u1",
      "quote": "把公司的产品手册做成知识库",
      "reading": "把现有的产品手册（文档）处理成一个可检索的知识库。"
    },
    {
      "ref": "u2",
      "quote": "以后能按意思搜到相关段落",
      "reading": "检索方式是语义检索（按意思匹配，不是关键词），返回的粒度是段落。"
    }
  ],
  "steps": [
    {
      "ref": "s1",
      "title": "提取正文文本",
      "intent": "把手册正文变成可处理的纯文本，保留章节/标题层级，供后续切段和定位来源用。",
      "input": "带文本层的产品手册（PDF 或 Word 文档）",
      "output": "保留标题层级的纯文本正文",
      "dependsOn": []
    },
    {
      "ref": "s2",
      "title": "按段落切分",
      "intent": "把正文切成以段落为单位的文本块，作为语义检索的最小召回单位。",
      "input": "保留标题层级的纯文本正文",
      "output": "带来源定位的段落文本块",
      "dependsOn": [
        "s1"
      ]
    },
    {
      "ref": "s3",
      "title": "段落向量化",
      "intent": "为每个段落生成能表达语义的向量，使“按意思”匹配成为可能。",
      "input": "带来源定位的段落文本块",
      "output": "每个段落对应的语义向量",
      "dependsOn": [
        "s2"
      ]
    },
    {
      "ref": "s4",
      "title": "建成可检索知识库",
      "intent": "把段落文本与向量建成语义检索索引，使段落能按语义被召回。",
      "input": "段落文本块及其语义向量",
      "output": "语义可检索的知识库索引",
      "dependsOn": [
        "s3"
      ]
    },
    {
      "ref": "s5",
      "title": "按意思检索返回段落",
      "intent": "接收用户的自然语言查询，返回语义上相关的段落。",
      "input": "用户的自然语言查询（外部输入）",
      "output": "命中的相关段落（附来源定位）",
      "dependsOn": [
        "s4"
      ]
    }
  ],
  "openQuestions": [
    {
      "ref": "q1",
      "question": "产品手册现在是什么形态？",
      "reason": "决定第一步是直接提取文本，还是要先做 OCR 扫描识别。",
      "affects": [
        "s1"
      ],
      "options": [
        "带文本层的 PDF",
        "Word 文档",
        "扫描件（无文字层）",
        "纸质手册",
        "网页/HTML"
      ]
    },
    {
      "ref": "q2",
      "question": "搜索结果里说的“段落”按什么粒度算？",
      "reason": "决定切分那一步把正文切成多大的块，粒度不同召回效果差别很大。",
      "affects": [
        "s2"
      ],
      "options": [
        "自然段落",
        "小节（带小标题）",
        "页面"
      ]
    }
  ]
}
