{
  "goal": "每天定时把新增的合同 PDF 解析出关键字段，写进数据库",
  "readiness": "partial",
  "understanding": [
    {
      "quote": "每天定时",
      "reading": "由每日定时任务触发，不是手动批量处理",
      "ref": "u1"
    },
    {
      "quote": "新增的合同 PDF",
      "reading": "处理对象是每天新增的合同 PDF；'新增'的口径后文补充为按文件落库时间、每天处理昨天落库的",
      "ref": "u2"
    },
    {
      "quote": "解析出关键字段",
      "reading": "从 PDF 内容里提取关键字段，字段清单还没定",
      "ref": "u3"
    },
    {
      "quote": "写进数据库",
      "reading": "解析结果落到数据库，目标表还没定",
      "ref": "u4"
    },
    {
      "quote": "PDF 都是扫描件",
      "reading": "所有合同 PDF 是扫描件，没有文字层，必须先 OCR 才能出文本",
      "ref": "u5"
    },
    {
      "quote": "「新增」按文件落库时间算,每天处理昨天落库的",
      "reading": "'新增'按文件落库时间判定，每天圈定昨天落库的合同 PDF",
      "ref": "u6"
    }
  ],
  "steps": [
    {
      "dependsOn": [],
      "input": "无上游数据；由每日定时信号触发，扫描合同 PDF 的存放位置",
      "intent": "每天按落库时间圈出昨天落库的合同 PDF，作为处理范围",
      "output": "昨日落库的合同 PDF 文件清单",
      "ref": "s1",
      "title": "圈定昨日落库的合同 PDF"
    },
    {
      "dependsOn": [
        "s1"
      ],
      "input": "扫描件合同 PDF（图像）",
      "intent": "把每份扫描合同识别成可解析的纯文本",
      "output": "每份合同对应的纯文本",
      "ref": "s2",
      "title": "OCR 识别出合同文本"
    },
    {
      "dependsOn": [
        "s2"
      ],
      "input": "合同纯文本",
      "intent": "从合同文本里提取关键字段，变成结构化记录",
      "output": "结构化字段记录（每份合同一条或多条）",
      "ref": "s3",
      "title": "解析关键字段"
    },
    {
      "dependsOn": [
        "s3"
      ],
      "input": "结构化字段记录",
      "intent": "把结构化字段记录写入数据库",
      "output": "数据库表中落库的合同字段",
      "ref": "s4",
      "title": "写入数据库"
    }
  ],
  "openQuestions": [
    {
      "affects": [
        "s3"
      ],
      "question": "要抽取哪些关键字段？",
      "reason": "决定解析环节要输出什么",
      "ref": "q3"
    },
    {
      "affects": [
        "s4"
      ],
      "question": "解析结果写进哪张表？",
      "reason": "决定落库目标",
      "ref": "q4"
    }
  ]
}
