{
  "goal": "每天定时把新增的合同 PDF 解析出关键字段，写进数据库",
  "readiness": "partial",
  "understanding": [
    {
      "ref": "u1",
      "quote": "PDF 都是扫描件",
      "reading": "合同 PDF 没有文字层，得靠 OCR 识别出文本，链路里要多一环 OCR"
    },
    {
      "ref": "u2",
      "quote": "「新增」按文件落库时间算",
      "reading": "筛文件的口径是落库时间，不是文件名或别的"
    },
    {
      "ref": "u3",
      "quote": "每天处理昨天落库的",
      "reading": "定时任务每天跑一次，处理前一天落库的合同 PDF"
    }
  ],
  "steps": [
    {
      "ref": "r1",
      "title": "识别昨天落库的合同 PDF",
      "intent": "从合同存放位置按落库时间筛出昨天落库的合同 PDF，形成待处理清单",
      "input": "存放合同 PDF 的位置（文件夹或对象存储），由每日定时信号触发",
      "output": "昨天落库的合同 PDF 清单",
      "dependsOn": []
    },
    {
      "ref": "r2",
      "title": "OCR 识别扫描件文本",
      "intent": "把每份扫描的合同 PDF 识别成可读的纯文本内容",
      "input": "昨天落库的合同 PDF 文件（扫描件）",
      "output": "每份合同的纯文本",
      "dependsOn": [
        "r1"
      ]
    },
    {
      "ref": "r3",
      "title": "抽取关键字段",
      "intent": "从每份合同文本中抽出一份合同对应的关键字段，形成结构化记录",
      "input": "每份合同的纯文本",
      "output": "每份合同的结构化字段（一条记录）",
      "dependsOn": [
        "r2"
      ]
    },
    {
      "ref": "r4",
      "title": "写入数据库",
      "intent": "把每份合同的结构化字段落到目标表",
      "input": "每份合同的结构化字段",
      "output": "数据库中的合同字段记录",
      "dependsOn": [
        "r3"
      ]
    }
  ],
  "openQuestions": [
    {
      "ref": "q3",
      "question": "关键字段是哪几个？",
      "reason": "决定 r3 从文本里抽什么，也决定落库记录的结构",
      "affects": [
        "r3",
        "r4"
      ]
    },
    {
      "ref": "q4",
      "question": "写到哪个数据库的哪张表？",
      "reason": "决定 r4 落库的目标位置",
      "affects": [
        "r4"
      ]
    }
  ]
}
