{
  "readiness": "partial",
  "goal": "每天定时把新增的合同 PDF 解析出关键字段并写进数据库。",
  "understanding": [
    {
      "ref": "u1",
      "quote": "每天定时",
      "reading": "触发方式是按天定时自动跑，不需要每次人工启动。"
    },
    {
      "ref": "u2",
      "quote": "把新增的合同 PDF",
      "reading": "处理对象是合同 PDF，且只处理“新增”的那部分；“新增”按什么口径判，需要用户定。"
    },
    {
      "ref": "u3",
      "quote": "解析出关键字段",
      "reading": "从每份合同里抽出关键字段，形成结构化结果。"
    },
    {
      "ref": "u4",
      "quote": "写进数据库",
      "reading": "抽出的字段最终落到数据库的表里。"
    }
  ],
  "steps": [
    {
      "ref": "r1",
      "title": "定时圈出新增合同",
      "intent": "每天到点自动启动，圈出当天按“新增”口径算进来的合同 PDF",
      "input": "由每天定时触发，不接收上游数据；按“新增”口径从合同 PDF 来源里圈出当天要处理的文件",
      "output": "当天新增的合同 PDF 文件清单",
      "dependsOn": []
    },
    {
      "ref": "r2",
      "title": "提取合同文本",
      "intent": "把每份合同 PDF 变成可供后续抽取的全文文本",
      "input": "当天新增的合同 PDF 文件（扫描件或带文字层，待确认）",
      "output": "每份合同的全文文本",
      "dependsOn": [
        "r1"
      ]
    },
    {
      "ref": "r3",
      "title": "抽取关键字段",
      "intent": "从全文文本里抽出约定的关键字段，形成结构化记录",
      "input": "每份合同的全文文本",
      "output": "每份合同的结构化关键字段（字段清单待确认）",
      "dependsOn": [
        "r2"
      ]
    },
    {
      "ref": "r4",
      "title": "写入数据库",
      "intent": "把结构化关键字段落成数据库里的记录",
      "input": "每份合同的结构化关键字段",
      "output": "数据库中的合同关键字段记录（目标库表待确认）",
      "dependsOn": [
        "r3"
      ]
    }
  ],
  "openQuestions": [
    {
      "ref": "q1",
      "question": "合同 PDF 是扫描件还是带文字层？",
      "reason": "决定提取文本这一步的输入形态和内部走法；扫描件要先走 OCR，带文字层可直接抽字。",
      "affects": [
        "r2"
      ],
      "options": [
        "扫描件（需 OCR）",
        "带文字层",
        "两种都有"
      ]
    },
    {
      "ref": "q2",
      "question": "“新增”按什么口径算？",
      "reason": "口径定错，链路照样能跑，但会漏单或重复，问题埋在后面。",
      "affects": [
        "r1"
      ],
      "options": [
        "文件放进指定目录的时间",
        "文件名或文件元数据里的日期",
        "数据库里还没有该合同的记录",
        "文件最后修改时间在当天"
      ]
    },
    {
      "ref": "q3",
      "question": "要抽哪些关键字段？",
      "reason": "决定从全文里抽什么、结构化结果长什么样。",
      "affects": [
        "r3"
      ]
    },
    {
      "ref": "q4",
      "question": "写进哪个数据库、哪张表？",
      "reason": "决定字段落到哪里、按什么结构存。",
      "affects": [
        "r4"
      ]
    }
  ]
}
