{
  "goal": "每天定时把新增的合同 PDF 解析出关键字段,写进数据库。",
  "readiness": "partial",
  "understanding": [
    {
      "ref": "r1",
      "quote": "每天定时把新增的合同 PDF",
      "reading": "一个每天定时跑的流程,处理新增的合同 PDF。"
    },
    {
      "ref": "r2",
      "quote": "PDF 都是扫描件",
      "reading": "合同 PDF 没有文字层,必须先 OCR 才能拿到文字。"
    },
    {
      "ref": "r3",
      "quote": "「新增」按文件落库时间算,每天处理昨天落库的",
      "reading": "新增=文件的落库时间落在昨天;当天跑的时候处理昨天落库的那批文件。"
    },
    {
      "ref": "r4",
      "quote": "解析出关键字段",
      "reading": "从每份合同里抽出需要入库的关键字段。"
    },
    {
      "ref": "r5",
      "quote": "写进数据库",
      "reading": "把抽出的字段落到数据库里。"
    }
  ],
  "steps": [
    {
      "dependsOn": [],
      "input": "存放扫描件合同 PDF 的存储位置,文件带落库时间;每天定时触发,不接收上游数据。",
      "intent": "确定当天要处理哪些合同 PDF——昨天落库的那批。",
      "output": "昨天落库的合同 PDF 文件清单。",
      "ref": "s1",
      "title": "找出昨天落库的合同 PDF"
    },
    {
      "dependsOn": [
        "s1"
      ],
      "input": "昨天落库的扫描件合同 PDF 文件。",
      "intent": "把扫描件合同 PDF 转成可读文本,供下一步抽字段。",
      "output": "每份合同对应的文本内容。",
      "ref": "s2",
      "title": "把扫描件 OCR 成文本"
    },
    {
      "dependsOn": [
        "s2"
      ],
      "input": "每份合同的文本内容。",
      "intent": "从合同文本中抽出需要入库的关键字段。",
      "output": "每份合同的结构化关键字段(键值对)。",
      "ref": "s3",
      "title": "抽取关键字段"
    },
    {
      "dependsOn": [
        "s3"
      ],
      "input": "每份合同的结构化关键字段。",
      "intent": "把抽出的关键字段落进目标表。",
      "output": "数据库中的合同记录。",
      "ref": "s4",
      "title": "写入数据库"
    }
  ],
  "openQuestions": [
    {
      "affects": [
        "s3",
        "s4"
      ],
      "question": "要抽哪几个关键字段?",
      "reason": "第三步抽哪些字段没有定义,直接决定解析结果和入库内容。",
      "ref": "q3"
    },
    {
      "affects": [
        "s4"
      ],
      "question": "抽出的关键字段写到哪张表,和表里的字段怎么对应?",
      "reason": "第四步落库目标没定,写错表过几个月才发现。",
      "ref": "q4"
    }
  ]
}
