{
  "goal": "每天定时把新增的合同扫描件 OCR 解析出关键字段，写进数据库",
  "readiness": "partial",
  "understanding": [
    {
      "ref": "r1",
      "quote": "每天定时",
      "reading": "需要一个以天为周期的定时触发。"
    },
    {
      "ref": "r2",
      "quote": "把新增的合同 PDF",
      "reading": "只处理新增的合同，不是每次全量；'新增'按什么口径算还不清楚。"
    },
    {
      "ref": "r3",
      "quote": "解析出关键字段",
      "reading": "从合同内容里抽取若干结构化字段，具体抽哪几个字段还不清楚。"
    },
    {
      "ref": "r4",
      "quote": "写进数据库",
      "reading": "结果落进数据库表，写到哪个库哪张表还不清楚。"
    },
    {
      "ref": "r5",
      "quote": "合同是别的部门给的,放在哪我也说不清,你先按常见的来吧",
      "reading": "存放位置不确定，授权我先按常见方式画；我按'一个共享文件夹/目录'处理。"
    },
    {
      "ref": "r6",
      "quote": "另外 PDF 都是扫描件",
      "reading": "PDF 都是图片扫描件、没有文本层，提取文本必须走 OCR。"
    }
  ],
  "steps": [
    {
      "ref": "s1",
      "title": "识别新增合同扫描件",
      "intent": "每天定时从存放合同的共享文件夹/目录里找出自上次处理以来新增的扫描件，形成待处理清单",
      "input": "存放新增合同扫描件的共享文件夹/目录＋定时触发信号",
      "output": "本次待处理的新增扫描件清单",
      "dependsOn": []
    },
    {
      "ref": "s2",
      "title": "OCR 提取合同文本",
      "intent": "对每份扫描件做 OCR，把图片内容变成可读的纯文本",
      "input": "本次待处理的新增扫描件清单",
      "output": "每份合同对应的纯文本",
      "dependsOn": [
        "s1"
      ]
    },
    {
      "ref": "s3",
      "title": "解析关键字段",
      "intent": "从合同文本中抽取约定的关键字段，形成结构化记录",
      "input": "每份合同对应的纯文本",
      "output": "每份合同的结构化字段记录",
      "dependsOn": [
        "s2"
      ]
    },
    {
      "ref": "s4",
      "title": "写入数据库",
      "intent": "把结构化字段记录落进目标数据库表",
      "input": "每份合同的结构化字段记录",
      "output": "数据库中的合同记录",
      "dependsOn": [
        "s3"
      ]
    }
  ],
  "openQuestions": [
    {
      "ref": "q2",
      "question": "“新增”按什么口径算？（比如：共享目录里自上次运行后新出现的文件；还是数据库里没有对应合同编号的）",
      "reason": "决定 s1 用哪种方式识别新增，选错会漏文件或重复处理。",
      "affects": [
        "s1"
      ]
    },
    {
      "ref": "q3",
      "question": "要解析出哪几个关键字段？",
      "reason": "决定 s3 的抽取目标和结构化记录长什么样。",
      "affects": [
        "s3"
      ]
    },
    {
      "ref": "q4",
      "question": "写进哪个数据库、哪张表？表结构是已有的还是要新建？",
      "reason": "决定 s4 的目标形态和字段映射。",
      "affects": [
        "s4"
      ]
    },
    {
      "ref": "q5",
      "question": "我按'一个共享文件夹/目录'画了存放位置，实际是哪里？",
      "reason": "决定 s1 从哪里读取文件，读错地方链路跑不起来。",
      "affects": [
        "s1"
      ]
    }
  ]
}
