
{
  "goal": "每天定时把新增的合同 PDF 解析出关键字段，写进数据库。",
  "readiness": "partial",
  "understanding": [
    {
      "ref": "r1",
      "quote": "每天定时",
      "reading": "需要一个每天定时触发的环节，不是手动单次处理。"
    },
    {
      "ref": "r2",
      "quote": "把新增的合同 PDF",
      "reading": "处理范围是新增的合同，不是全量重跑；新增按什么口径判断还没定。"
    },
    {
      "ref": "r3",
      "quote": "解析出关键字段",
      "reading": "要从 PDF 里抽出字段；PDF 是扫描件还是带文本层没有说明，这决定要不要先 OCR。"
    },
    {
      "ref": "r4",
      "quote": "写进数据库",
      "reading": "最终落点是数据库；具体写到哪张表、什么结构没定。"
    }
  ],
  "steps": [
    {
      "ref": "s1",
      "title": "定时发现新增合同 PDF",
      "intent": "每天确定本次需要处理的合同 PDF 范围，只圈出新增的那批",
      "input": "定时信号触发，不接收上游数据；上游是存放合同 PDF 的位置",
      "output": "本次新增的合同 PDF 清单",
      "dependsOn": []
    },
    {
      "ref": "s2",
      "title": "PDF 转文本",
      "intent": "把每份合同 PDF 变成可以抽取字段的文本；若是扫描件，这一步先做 OCR",
      "input": "本次新增的合同 PDF 文件",
      "output": "每份合同对应的纯文本",
      "dependsOn": [
        "s1"
      ]
    },
    {
      "ref": "s3",
      "title": "抽取关键字段",
      "intent": "从合同文本中识别并抽出需要的关键字段，形成结构化记录",
      "input": "每份合同的纯文本",
      "output": "结构化的字段集合",
      "dependsOn": [
        "s2"
      ]
    },
    {
      "ref": "s4",
      "title": "写入数据库",
      "intent": "把结构化字段写入目标数据库表",
      "input": "结构化的字段集合",
      "output": "数据库中的合同记录",
      "dependsOn": [
        "s3"
      ]
    }
  ],
  "openQuestions": [
    {
      "ref": "q1",
      "question": "合同 PDF 是扫描件，还是带文本层的电子版？",
      "reason": "决定 s2 是否必须含 OCR，直接改变这一步的处理方式。",
      "affects": [
        "s2"
      ]
    },
    {
      "ref": "q2",
      "question": "「新增」按什么口径判断？比如按文件落库时间、文件名，还是按合同编号去重？",
      "reason": "决定 s1 怎么圈定本次处理范围；口径错了一开始就会漏或多处理。",
      "affects": [
        "s1"
      ]
    },
    {
      "ref": "q3",
      "question": "关键字段具体要哪些？",
      "reason": "决定 s3 抽出哪些字段、结构化结果长什么样。",
      "affects": [
        "s3"
      ]
    },
    {
      "ref": "q4",
      "question": "写进哪个数据库、哪张表？",
      "reason": "决定 s4 的落点，字段要和表结构对得上。",
      "affects": [
        "s4"
      ]
    }
  ]
}
