{
  "readiness": "partial",
  "goal": "每天定时把新增的合同 PDF 解析出关键字段，写入数据库。",
  "understanding": [
    {
      "ref": "u1",
      "quote": "每天定时",
      "reading": "按固定时间触发，不是实时流式处理。"
    },
    {
      "ref": "u2",
      "quote": "把新增的合同 PDF",
      "reading": "处理对象是合同 PDF，且只处理新增的那部分；'新增'按什么口径判断还需要明确。"
    },
    {
      "ref": "u3",
      "quote": "解析出关键字段",
      "reading": "从 PDF 内容里抽取结构化的关键字段，具体抽哪些字段尚未说明。"
    },
    {
      "ref": "u4",
      "quote": "写进数据库",
      "reading": "最终落库，写到哪个库哪张表尚未说明。"
    }
  ],
  "steps": [
    {
      "ref": "s1",
      "title": "定时筛出新增合同 PDF",
      "intent": "每次定时触发时，从合同 PDF 的存放处挑出本次新增、尚未处理的那一批，供后续环节处理。",
      "input": "触发：定时信号；数据：存放处的合同 PDF（含已处理与未处理的）。",
      "output": "本次新增的合同 PDF 文件清单。",
      "dependsOn": []
    },
    {
      "ref": "s2",
      "title": "从 PDF 提取文本",
      "intent": "把每个 PDF 里的文字内容变成可供字段抽取的纯文本。",
      "input": "本次新增的合同 PDF 文件。",
      "output": "每个 PDF 对应的纯文本内容。",
      "dependsOn": ["s1"]
    },
    {
      "ref": "s3",
      "title": "抽取关键字段",
      "intent": "从合同文本中识别并抽取约定的关键字段，形成结构化数据。",
      "input": "每个合同的纯文本内容。",
      "output": "每个合同对应的结构化关键字段。",
      "dependsOn": ["s2"]
    },
    {
      "ref": "s4",
      "title": "写入数据库",
      "intent": "把抽取出的结构化字段落成数据库里的合同记录。",
      "input": "结构化关键字段。",
      "output": "数据库中的合同记录。",
      "dependsOn": ["s3"]
    }
  ],
  "openQuestions": [
    {
      "ref": "q1",
      "question": "合同 PDF 是本身带文字层，还是扫描件？",
      "reason": "决定第二环是直接提取文本，还是先 OCR 再提取，两者是不同的链。",
      "affects": ["s2"]
    },
    {
      "ref": "q2",
      "question": "合同 PDF 存放在哪里，'新增'按什么口径判断？",
      "reason": "决定第一环从哪里取文件、用什么标准认定一个 PDF 属于本次新增。",
      "affects": ["s1"]
    },
    {
      "ref": "q3",
      "question": "关键字段具体抽哪几个？",
      "reason": "第三环的抽取目标只有你那边有定义，缺了它这条链跑起来也不知道抽什么。",
      "affects": ["s3"]
    },
    {
      "ref": "q4",
      "question": "写进哪个数据库、哪张表？",
      "reason": "决定第四环的落库目标。",
      "affects": ["s4"]
    }
  ]
}
