{
  "readiness": "partial",
  "goal": "每天定时把新增的合同 PDF 解析出关键字段并写入数据库",
  "understanding": [
    {
      "ref": "u1",
      "quote": "每天定时",
      "reading": "以日为周期、按时间信号触发的定时任务"
    },
    {
      "ref": "u2",
      "quote": "新增的合同 PDF",
      "reading": "只处理当天范围内新增的合同 PDF，需要按某种口径界定「新增」"
    },
    {
      "ref": "u3",
      "quote": "解析出关键字段",
      "reading": "从合同正文里提取出一组结构化的关键字段值"
    },
    {
      "ref": "u4",
      "quote": "写进数据库",
      "reading": "把解析结果落成数据库中的记录"
    }
  ],
  "steps": [
    {
      "ref": "s1",
      "title": "筛出当日新增的合同 PDF",
      "intent": "每天定时触发时，按既定口径圈定当天新增的合同 PDF，形成待处理清单",
      "input": "存储中的合同 PDF 集合；每日定时信号触发，不接收上游数据",
      "output": "当天待处理的新增合同 PDF 清单",
      "dependsOn": []
    },
    {
      "ref": "s2",
      "title": "把合同 PDF 转成可读取的文本",
      "intent": "从每份合同 PDF 中取出全文文本（扫描件需先 OCR，带文本层可直接抽取），供字段解析使用",
      "input": "当天待处理的新增合同 PDF 清单",
      "output": "每份合同对应的全文文本",
      "dependsOn": [
        "s1"
      ]
    },
    {
      "ref": "s3",
      "title": "从合同文本中解析关键字段",
      "intent": "按约定的字段口径，从每份合同文本中提取关键字段并整理成结构化记录",
      "input": "每份合同对应的全文文本",
      "output": "每份合同一条结构化字段记录",
      "dependsOn": [
        "s2"
      ]
    },
    {
      "ref": "s4",
      "title": "把字段记录写入数据库",
      "intent": "将解析出的结构化字段写入指定的数据库表，形成可查询的合同字段数据",
      "input": "每份合同一条结构化字段记录",
      "output": "数据库目标表中的合同字段记录",
      "dependsOn": [
        "s3"
      ]
    }
  ],
  "openQuestions": [
    {
      "ref": "q1",
      "question": "合同 PDF 是扫描件、带文本层的电子合同，还是两种都有？",
      "reason": "决定「PDF→文本」这一环走 OCR 还是直接抽取，走错了解析出来的文本就是空的或乱的。",
      "affects": [
        "s2"
      ],
      "options": [
        "扫描件",
        "带文本层",
        "两种都有"
      ]
    },
    {
      "ref": "q2",
      "question": "「新增」按什么口径算？",
      "reason": "定时任务圈定待处理文件时，按错口径会漏处理或重复处理。",
      "affects": [
        "s1"
      ],
      "options": [
        "文件落到存储的时间",
        "文件名中的日期",
        "文件修改时间"
      ]
    },
    {
      "ref": "q3",
      "question": "关键字段具体是哪几个？",
      "reason": "解析环节提取什么内容完全由字段清单决定。",
      "affects": [
        "s3"
      ]
    },
    {
      "ref": "q4",
      "question": "写进哪个数据库的哪张表？",
      "reason": "写入环节的目标位置不明确，链路无法落到具体表结构。",
      "affects": [
        "s4"
      ]
    }
  ]
}
