{
  "readiness": "partial",
  "goal": "每天定时把新增的合同 PDF 解析出关键字段，写进数据库",
  "understanding": [
    {
      "ref": "u1",
      "quote": "每天定时",
      "reading": "每天定时触发一次处理，不是实时监听"
    },
    {
      "ref": "u2",
      "quote": "新增的合同 PDF",
      "reading": "只处理当天新到的合同 PDF，不重复处理历史文件；「新增」按什么口径算还没说明"
    },
    {
      "ref": "u3",
      "quote": "解析出关键字段",
      "reading": "从合同内容里抽出一份合同对应的关键字段，形成结构化记录；具体是哪些字段还没说明"
    },
    {
      "ref": "u4",
      "quote": "写进数据库",
      "reading": "把结构化字段落到目标表；落到哪个数据库哪张表还没说明"
    }
  ],
  "steps": [
    {
      "ref": "r1",
      "title": "识别当天新增的合同 PDF",
      "intent": "从合同存放位置筛出当天新增的合同 PDF，形成待处理清单",
      "input": "存放合同 PDF 的位置（文件夹或对象存储），由每日定时信号触发",
      "output": "当天新增合同 PDF 的清单",
      "dependsOn": []
    },
    {
      "ref": "r2",
      "title": "提取 PDF 文本",
      "intent": "把每份 PDF 转成可读的纯文本内容",
      "input": "当天新增的合同 PDF 文件",
      "output": "每份合同的纯文本",
      "dependsOn": [
        "r1"
      ]
    },
    {
      "ref": "r3",
      "title": "抽取关键字段",
      "intent": "从每份合同文本中抽出一份合同对应的关键字段，形成结构化记录",
      "input": "每份合同的纯文本",
      "output": "每份合同的结构化字段（一条记录）",
      "dependsOn": [
        "r2"
      ]
    },
    {
      "ref": "r4",
      "title": "写入数据库",
      "intent": "把每份合同的结构化字段落到目标表",
      "input": "每份合同的结构化字段",
      "output": "数据库中的合同字段记录",
      "dependsOn": [
        "r3"
      ]
    }
  ],
  "openQuestions": [
    {
      "ref": "q1",
      "question": "「新增」按什么口径算？",
      "reason": "决定了 r1 怎么筛文件，口径错了要么漏处理、要么重复处理",
      "affects": [
        "r1"
      ],
      "options": [
        "按文件落库/上传时间",
        "按文件名规则",
        "与已处理过的记录比对"
      ]
    },
    {
      "ref": "q2",
      "question": "合同 PDF 是扫描件还是带文字层？",
      "reason": "扫描件需要多一步 OCR，整条链会多一环",
      "affects": [
        "r2"
      ],
      "options": [
        "带文字层",
        "扫描件",
        "两种都有"
      ]
    },
    {
      "ref": "q3",
      "question": "关键字段是哪几个？",
      "reason": "决定 r3 从文本里抽什么，也决定落库记录的结构",
      "affects": [
        "r3",
        "r4"
      ]
    },
    {
      "ref": "q4",
      "question": "写到哪个数据库的哪张表？",
      "reason": "决定 r4 落库的目标位置",
      "affects": [
        "r4"
      ]
    }
  ]
}
