{
  "readiness": "partial",
  "goal": "每天定时把新增的合同 PDF 解析出关键字段,写进数据库。",
  "understanding": [
    {
      "ref": "r1",
      "quote": "每天定时把新增的合同 PDF",
      "reading": "一个每天定时跑的流程,处理新增的合同 PDF 文件。"
    },
    {
      "ref": "r2",
      "quote": "解析出关键字段",
      "reading": "从每份合同里抽出需要的关键字段。"
    },
    {
      "ref": "r3",
      "quote": "写进数据库",
      "reading": "把抽出的字段落到数据库里。"
    }
  ],
  "steps": [
    {
      "ref": "s1",
      "title": "找出当天新增的合同 PDF",
      "intent": "确定当天要处理哪些合同 PDF。",
      "input": "存放合同 PDF 的来源位置;每天定时触发,不接收上游数据。",
      "output": "当天新增的合同 PDF 文件清单。",
      "dependsOn": []
    },
    {
      "ref": "s2",
      "title": "提取合同 PDF 的文本",
      "intent": "把每份合同 PDF 变成可读文本,供下一步抽字段。",
      "input": "当天新增的合同 PDF 文件。",
      "output": "每份合同对应的文本内容。",
      "dependsOn": [
        "s1"
      ]
    },
    {
      "ref": "s3",
      "title": "抽取关键字段",
      "intent": "从合同文本中抽出需要入库的关键字段。",
      "input": "每份合同的文本内容。",
      "output": "每份合同的结构化关键字段(键值对)。",
      "dependsOn": [
        "s2"
      ]
    },
    {
      "ref": "s4",
      "title": "写入数据库",
      "intent": "把抽出的关键字段落进目标表。",
      "input": "每份合同的结构化关键字段。",
      "output": "数据库中的合同记录。",
      "dependsOn": [
        "s3"
      ]
    }
  ],
  "openQuestions": [
    {
      "ref": "q1",
      "question": "新增的合同 PDF 放在哪里,按什么口径算\"新增\"?",
      "reason": "决定第一步怎么找出当天要处理的文件,口径错了会漏处理或重复入库。",
      "affects": [
        "s1"
      ],
      "options": [
        "共享文件夹,按文件出现/修改时间判定",
        "共享文件夹,按是否已入库对比判定",
        "业务系统定时推送合同清单"
      ]
    },
    {
      "ref": "q2",
      "question": "合同 PDF 是扫描件还是带文字层?",
      "reason": "决定第二步是直接提取文本还是先做 OCR,链路走向不同。",
      "affects": [
        "s2"
      ],
      "options": [
        "带文字层(可直接提取文本)",
        "扫描件(需要 OCR)"
      ]
    },
    {
      "ref": "q3",
      "question": "要抽哪几个关键字段?",
      "reason": "第三步抽哪些字段没有定义,直接决定解析结果和入库内容。",
      "affects": [
        "s3",
        "s4"
      ]
    },
    {
      "ref": "q4",
      "question": "写进哪个数据库的哪张表,表结构和抽出的字段怎么对应?",
      "reason": "第四步落库目标没定,写错表过几个月才发现。",
      "affects": [
        "s4"
      ]
    }
  ]
}
