{
  "readiness": "partial",
  "goal": "每天定时把前一天落库的合同扫描件解析出关键字段并写进数据库。",
  "understanding": [
    {
      "quote": "每天定时",
      "reading": "按天定时自动跑，不需要每次人工启动。",
      "ref": "u1"
    },
    {
      "quote": "把新增的合同 PDF",
      "reading": "处理对象是合同 PDF，只处理“新增”的那部分。",
      "ref": "u2"
    },
    {
      "quote": "解析出关键字段",
      "reading": "从每份合同里抽出关键字段，形成结构化结果。",
      "ref": "u3"
    },
    {
      "quote": "写进数据库",
      "reading": "抽出的字段最终落到数据库的表里。",
      "ref": "u4"
    },
    {
      "quote": "PDF 都是扫描件",
      "reading": "合同 PDF 全是扫描件，没有文字层，提取文本要走 OCR。",
      "ref": "u5"
    },
    {
      "quote": "「新增」按文件落库时间算",
      "reading": "“新增”口径是文件落进存储的时间。",
      "ref": "u6"
    },
    {
      "quote": "每天处理昨天落库的",
      "reading": "每天定时处理前一天落库的那批文件。",
      "ref": "u7"
    }
  ],
  "steps": [
    {
      "dependsOn": [],
      "input": "由每天定时触发，不接收上游数据；按文件落库时间圈出前一天落库的合同 PDF（扫描件）",
      "intent": "每天到点自动启动，圈出前一天落库、当天要处理的合同扫描件",
      "output": "前一天落库的合同扫描件文件清单",
      "ref": "r1",
      "title": "定时圈出昨天落库的合同"
    },
    {
      "dependsOn": [
        "r1"
      ],
      "input": "前一天落库的合同扫描件（图片，无文字层）",
      "intent": "把每份扫描件里的文字识别成可供后续抽取的全文文本",
      "output": "每份合同的全文文本",
      "ref": "r2",
      "title": "提取合同文本"
    },
    {
      "dependsOn": [
        "r2"
      ],
      "input": "每份合同的全文文本",
      "intent": "从全文文本里抽出约定的关键字段，形成结构化记录",
      "output": "每份合同的结构化关键字段（字段清单待确认）",
      "ref": "r3",
      "title": "抽取关键字段"
    },
    {
      "dependsOn": [
        "r3"
      ],
      "input": "每份合同的结构化关键字段",
      "intent": "把结构化关键字段落成数据库里的记录",
      "output": "数据库中的合同关键字段记录（目标库表待确认）",
      "ref": "r4",
      "title": "写入数据库"
    }
  ],
  "openQuestions": [
    {
      "affects": [
        "r3"
      ],
      "question": "要抽哪些关键字段？",
      "reason": "决定从全文里抽什么、结构化结果长什么样。",
      "ref": "q3"
    },
    {
      "affects": [
        "r4"
      ],
      "question": "写进哪个数据库、哪张表？",
      "reason": "决定字段落到哪里、按什么结构存。",
      "ref": "q4"
    }
  ]
}
