{
  "readiness": "partial",
  "goal": "把公司产品手册（扫描件与电子版混合）建成知识库，支持按语义检索并返回相关段落，表格里的参数可被搜到，图片内容不纳入。",
  "understanding": [
    {
      "ref": "u1",
      "quote": "把公司的产品手册做成知识库",
      "reading": "把现有的产品手册处理成一个可检索的知识库。"
    },
    {
      "ref": "u2",
      "quote": "以后能按意思搜到相关段落",
      "reading": "检索方式是语义检索（按意思匹配），返回粒度是段落。"
    },
    {
      "ref": "u3",
      "quote": "扫描件和电子版混在一起，得先分开走。",
      "reading": "手册里同时有扫描件和带文本层的电子版，需要先按形态分流，再各自处理。"
    },
    {
      "ref": "u4",
      "quote": "表格里的参数要能搜到，",
      "reading": "表格内容（参数）要转成文本进入检索，不能丢。"
    },
    {
      "ref": "u5",
      "quote": "图片不重要。",
      "reading": "图片内容不需要提取或索引，可以丢弃。"
    }
  ],
  "steps": [
    {
      "ref": "s6",
      "title": "分流扫描件与电子版",
      "intent": "把混在一起的手册按形态分成扫描件、电子版两堆，各自走后续处理。",
      "input": "混在一起的扫描件与电子版产品手册（原始文件集合）",
      "output": "分开的扫描件集合与电子版集合",
      "dependsOn": []
    },
    {
      "ref": "s1",
      "title": "电子版提取文本",
      "intent": "从电子版手册提取正文；表格转成结构化文本使参数可检索；图片内容丢弃。",
      "input": "分流出的电子版手册",
      "output": "电子版纯文本（含表格结构化文本）",
      "dependsOn": [
        "s6"
      ]
    },
    {
      "ref": "s7",
      "title": "扫描件 OCR 识别",
      "intent": "对扫描件做 OCR，识别正文与表格并把表格转成结构化文本，图片内容不提取。",
      "input": "分流出的扫描件手册",
      "output": "扫描件纯文本（含表格结构化文本）",
      "dependsOn": [
        "s6"
      ]
    },
    {
      "ref": "s2",
      "title": "按段落切分",
      "intent": "把两路纯文本切成以段落、表格为单位的文本块，作为语义检索的最小召回单位。",
      "input": "电子版与扫描件的纯文本（含表格结构化文本）",
      "output": "带来源定位的段落及表格文本块",
      "dependsOn": [
        "s1",
        "s7"
      ]
    },
    {
      "ref": "s3",
      "title": "文本块向量化",
      "intent": "为每个文本块生成语义向量，使按意思匹配成为可能。",
      "input": "带来源定位的段落及表格文本块",
      "output": "每个文本块对应的语义向量",
      "dependsOn": [
        "s2"
      ]
    },
    {
      "ref": "s4",
      "title": "建成可检索知识库",
      "intent": "把文本块与向量建成语义检索索引，使段落和表格参数能被按语义召回。",
      "input": "文本块及其语义向量",
      "output": "语义可检索的知识库索引",
      "dependsOn": [
        "s3"
      ]
    },
    {
      "ref": "s5",
      "title": "按意思检索返回段落",
      "intent": "接收自然语言查询，返回语义相关的段落或表格（附来源定位）。",
      "input": "用户的自然语言查询（外部输入）",
      "output": "命中的相关段落/表格（附来源定位）",
      "dependsOn": [
        "s4"
      ]
    }
  ],
  "openQuestions": [
    {
      "ref": "q2",
      "question": "搜索结果里说的“段落”按什么粒度算？（表格内容会单独作为可检索块处理）",
      "reason": "决定切分那一步把正文切成多大的块，粒度不同召回效果差别很大。",
      "affects": [
        "s2"
      ],
      "options": [
        "自然段落",
        "小节（带小标题）",
        "页面"
      ]
    }
  ]
}
